{
  "title": "Example page",
  "type": "wp-page",
  "version": "0.4",
  "page_settings": {},
  "content": [
    {
      "id": "container1",
      "elType": "container",
      "settings": {},
      "elements": [
        {
          "id": "heading1",
          "elType": "widget",
          "widgetType": "heading",
          "settings": {
            "title": "Example heading"
          },
          "elements": []
        }
      ]
    }
  ]
}
